{
  "format": "atlasmap",
  "schema": 1,
  "app": "0.1.0",
  "nodes": [
    {
      "id": "n1",
      "label": "Quarterly plan",
      "notes": "Ünïcode notes ✦ — with a second line\nand an emoji 🌌",
      "links": [],
      "x": 0,
      "y": 12.5,
      "z": -3.25,
      "cluster_color_id": 1,
      "blend": [
        0.25,
        0.5,
        0.75
      ],
      "is_core": true
    },
    {
      "id": "n2",
      "label": "Hiring",
      "notes": "",
      "links": [],
      "x": 90.125,
      "y": 20,
      "z": 0,
      "cluster_color_id": 1,
      "blend": null,
      "is_core": false
    },
    {
      "id": "n3",
      "label": "",
      "notes": "no label, notes only",
      "links": [],
      "x": -40,
      "y": -30,
      "z": -900.5,
      "cluster_color_id": 0,
      "blend": null,
      "is_core": false
    }
  ],
  "edges": [
    {
      "id": "e1",
      "from": "n1",
      "to": "n2",
      "directed": true,
      "label": "depends on"
    },
    {
      "id": "e2",
      "from": "n2",
      "to": "n3",
      "directed": false,
      "label": ""
    }
  ],
  "camera": {
    "position": [
      10,
      20,
      260
    ],
    "rotation": [
      0.1,
      -0.2,
      0
    ]
  }
}
